{
  "registry_format_version": 1,
  "release_version": "0.1.0",
  "distribution": {
    "kind": "repository",
    "path": "registry/",
    "published": false
  },
  "components": [
    {
      "name": "combobox",
      "version": "0.1.0",
      "status": "implementation_in_progress",
      "spec": "registry/combobox/spec.md",
      "conformance_manifest": "registry/combobox/tests/conformance.json",
      "source_files": [
        "registry/combobox/src/lib.rs"
      ],
      "dependencies": [
        {
          "name": "mkit-core",
          "version": "0.1.0"
        },
        {
          "name": "gpui-pre",
          "version": "0.3.5"
        }
      ],
      "component_dependencies": []
    },
    {
      "name": "scrubbable-number-field",
      "version": "0.1.0",
      "status": "implementation_in_progress",
      "spec": "registry/scrubbable-number-field/spec.md",
      "conformance_manifest": "registry/scrubbable-number-field/tests/conformance.json",
      "source_files": [
        "registry/scrubbable-number-field/src/lib.rs"
      ],
      "dependencies": [
        {
          "name": "mkit-core",
          "version": "0.1.0"
        },
        {
          "name": "gpui-pre",
          "version": "0.3.5"
        }
      ],
      "component_dependencies": []
    },
    {
      "name": "button",
      "version": "0.1.0",
      "status": "implementation_in_progress",
      "spec": "registry/button/spec.md",
      "conformance_manifest": "registry/button/tests/conformance.json",
      "source_files": [
        "registry/button/src/lib.rs"
      ],
      "dependencies": [
        {
          "name": "mkit-core",
          "version": "0.1.0"
        },
        {
          "name": "gpui-pre",
          "version": "0.3.5"
        }
      ],
      "component_dependencies": []
    },
    {
      "name": "icon-button",
      "version": "0.1.0",
      "status": "implementation_in_progress",
      "spec": "registry/icon-button/spec.md",
      "conformance_manifest": "registry/icon-button/tests/conformance.json",
      "source_files": [
        "registry/icon-button/src/lib.rs"
      ],
      "dependencies": [
        {
          "name": "mkit-core",
          "version": "0.1.0"
        },
        {
          "name": "gpui-pre",
          "version": "0.3.5"
        }
      ],
      "component_dependencies": []
    },
    {
      "name": "toggle-button",
      "version": "0.1.0",
      "status": "implementation_in_progress",
      "spec": "registry/toggle-button/spec.md",
      "conformance_manifest": "registry/toggle-button/tests/conformance.json",
      "source_files": [
        "registry/toggle-button/src/lib.rs"
      ],
      "dependencies": [
        {
          "name": "mkit-core",
          "version": "0.1.0"
        },
        {
          "name": "gpui-pre",
          "version": "0.3.5"
        }
      ],
      "component_dependencies": []
    },
    {
      "name": "toggle-group",
      "version": "0.1.0",
      "status": "implementation_in_progress",
      "spec": "registry/toggle-group/spec.md",
      "conformance_manifest": "registry/toggle-group/tests/conformance.json",
      "source_files": [
        "registry/toggle-group/src/lib.rs"
      ],
      "dependencies": [
        {
          "name": "mkit-core",
          "version": "0.1.0"
        },
        {
          "name": "gpui-pre",
          "version": "0.3.5"
        }
      ],
      "component_dependencies": []
    },
    {
      "name": "checkbox",
      "version": "0.1.0",
      "status": "implementation_in_progress",
      "spec": "registry/checkbox/spec.md",
      "conformance_manifest": "registry/checkbox/tests/conformance.json",
      "source_files": [
        "registry/checkbox/src/lib.rs"
      ],
      "dependencies": [
        {
          "name": "mkit-core",
          "version": "0.1.0"
        },
        {
          "name": "gpui-pre",
          "version": "0.3.5"
        }
      ],
      "component_dependencies": []
    },
    {
      "name": "radio-group",
      "version": "0.1.0",
      "status": "implementation_in_progress",
      "spec": "registry/radio-group/spec.md",
      "conformance_manifest": "registry/radio-group/tests/conformance.json",
      "source_files": [
        "registry/radio-group/src/lib.rs"
      ],
      "dependencies": [
        {
          "name": "mkit-core",
          "version": "0.1.0"
        },
        {
          "name": "gpui-pre",
          "version": "0.3.5"
        }
      ],
      "component_dependencies": []
    },
    {
      "name": "switch",
      "version": "0.1.0",
      "status": "implementation_in_progress",
      "spec": "registry/switch/spec.md",
      "conformance_manifest": "registry/switch/tests/conformance.json",
      "source_files": [
        "registry/switch/src/lib.rs"
      ],
      "dependencies": [
        {
          "name": "mkit-core",
          "version": "0.1.0"
        },
        {
          "name": "gpui-pre",
          "version": "0.3.5"
        }
      ],
      "component_dependencies": []
    },
    {
      "name": "slider",
      "version": "0.1.0",
      "status": "implementation_in_progress",
      "spec": "registry/slider/spec.md",
      "conformance_manifest": "registry/slider/tests/conformance.json",
      "source_files": [
        "registry/slider/src/lib.rs"
      ],
      "dependencies": [
        {
          "name": "mkit-core",
          "version": "0.1.0"
        },
        {
          "name": "gpui-pre",
          "version": "0.3.5"
        }
      ],
      "component_dependencies": []
    },
    {
      "name": "progress",
      "version": "0.1.0",
      "status": "implementation_in_progress",
      "spec": "registry/progress/spec.md",
      "conformance_manifest": "registry/progress/tests/conformance.json",
      "source_files": [
        "registry/progress/src/lib.rs"
      ],
      "dependencies": [
        {
          "name": "mkit-core",
          "version": "0.1.0"
        },
        {
          "name": "gpui-pre",
          "version": "0.3.5"
        }
      ],
      "component_dependencies": []
    },
    {
      "name": "text-field",
      "version": "0.1.0",
      "status": "implementation_in_progress",
      "spec": "registry/text-field/spec.md",
      "conformance_manifest": "registry/text-field/tests/conformance.json",
      "source_files": [
        "registry/text-field/src/lib.rs"
      ],
      "dependencies": [
        {
          "name": "mkit-core",
          "version": "0.1.0"
        },
        {
          "name": "gpui-pre",
          "version": "0.3.5"
        }
      ],
      "component_dependencies": []
    },
    {
      "name": "text-area",
      "version": "0.1.0",
      "status": "implementation_in_progress",
      "spec": "registry/text-area/spec.md",
      "conformance_manifest": "registry/text-area/tests/conformance.json",
      "source_files": [
        "registry/text-area/src/lib.rs"
      ],
      "dependencies": [
        {
          "name": "mkit-core",
          "version": "0.1.0"
        },
        {
          "name": "gpui-pre",
          "version": "0.3.5"
        }
      ],
      "component_dependencies": []
    },
    {
      "name": "breadcrumbs",
      "version": "0.1.0",
      "status": "implementation_in_progress",
      "spec": "registry/breadcrumbs/spec.md",
      "conformance_manifest": "registry/breadcrumbs/tests/conformance.json",
      "source_files": [
        "registry/breadcrumbs/src/lib.rs"
      ],
      "dependencies": [
        {
          "name": "mkit-core",
          "version": "0.1.0"
        },
        {
          "name": "gpui-pre",
          "version": "0.3.5"
        }
      ],
      "component_dependencies": []
    },
    {
      "name": "context-menu",
      "version": "0.1.0",
      "status": "implementation_in_progress",
      "spec": "registry/context-menu/spec.md",
      "conformance_manifest": "registry/context-menu/tests/conformance.json",
      "source_files": [
        "registry/context-menu/src/lib.rs"
      ],
      "dependencies": [
        {
          "name": "mkit-core",
          "version": "0.1.0"
        },
        {
          "name": "gpui-pre",
          "version": "0.3.5"
        },
        {
          "name": "mkit-registry-key-hint",
          "version": "0.1.0"
        }
      ],
      "component_dependencies": ["key-hint"]
    },
    {
      "name": "data-table",
      "version": "0.1.0",
      "status": "implementation_in_progress",
      "spec": "registry/data-table/spec.md",
      "conformance_manifest": "registry/data-table/tests/conformance.json",
      "source_files": [
        "registry/data-table/src/lib.rs"
      ],
      "dependencies": [
        {
          "name": "mkit-core",
          "version": "0.1.0"
        },
        {
          "name": "gpui-pre",
          "version": "0.3.5"
        }
      ],
      "component_dependencies": []
    },
    {
      "name": "dialog",
      "version": "0.1.0",
      "status": "implementation_in_progress",
      "spec": "registry/dialog/spec.md",
      "conformance_manifest": "registry/dialog/tests/conformance.json",
      "source_files": [
        "registry/dialog/src/lib.rs"
      ],
      "dependencies": [
        {
          "name": "mkit-core",
          "version": "0.1.0"
        },
        {
          "name": "gpui-pre",
          "version": "0.3.5"
        }
      ],
      "component_dependencies": []
    },
    {
      "name": "dropdown-menu",
      "version": "0.1.0",
      "status": "implementation_in_progress",
      "spec": "registry/dropdown-menu/spec.md",
      "conformance_manifest": "registry/dropdown-menu/tests/conformance.json",
      "source_files": [
        "registry/dropdown-menu/src/lib.rs"
      ],
      "dependencies": [
        {
          "name": "mkit-core",
          "version": "0.1.0"
        },
        {
          "name": "gpui-pre",
          "version": "0.3.5"
        },
        {
          "name": "mkit-registry-key-hint",
          "version": "0.1.0"
        }
      ],